component,material,change,baseline_mass_kg_est,candidate_mass_kg_est,delta_kg_est
Cu_50mK_Local_Can_Cylinder_2mm,Copper,removed incorrect x-axis open sleeve,0.6267019928021287,0.0,-0.6267019928021287
Cu_50mK_StillLike_Can,Copper,added z-axis 2 mm Still-like can closed to 50 mK cold plate with Boolean rectangular side window,0.0,1.1027285271658798,1.1027285271658798
Nb magnetic end caps,Nb,added back cold-finger-hole cap only; incident side left open behind thin Al window,0.0,0.07655682734883569,0.07655682734883569
MuMetal magnetic end caps,MuMetal,added back cold-finger-hole cap only; incident side left open behind thin Al window,0.0,0.08953916053849344,0.08953916053849344
Win_MagShield_Al_foil_side,Aluminium,added thin Al incident foil for magnetic-shield aperture,0.0,9.726490800000001e-05,9.726490800000001e-05
